<?xml version="1.0" encoding="UTF-8"?>
<BusinessTransactions xmlns:xsi="http://www.w3.org/2001/XMLSchema-instance" Controller="http://localhost:8080/controller/rest" GenerationTime="2013-06-14T21:54:58.701673-04:00" xsi:noNamespaceSchemaLocation="../examples/xsd/bt_metrics.xsd">
  <BusinessTransaction>
    <ApplicationName>ACME Book Store Application</ApplicationName>
    <BusinessTransactionName>/appdynamicspilot/</BusinessTransactionName>
    <TierName>ECommerce Server</TierName>
    <AverageResponseTime>23</AverageResponseTime>
    <CallsPerMinute>50</CallsPerMinute>
    <TotalCalls>750</TotalCalls>
    <TotalErrors>0</TotalErrors>
    <ErrorsPerMinute>0</ErrorsPerMinute>
    <ErrorPercentage>0.0</ErrorPercentage>
    <SlowCalls>0</SlowCalls>
    <VerySlowCalls>0</VerySlowCalls>
    <Stalls>0</Stalls>
  </BusinessTransaction>
  <BusinessTransaction>
    <ApplicationName>ACME Book Store Application</ApplicationName>
    <BusinessTransactionName>UserLogOut.memberLogOut</BusinessTransactionName>
    <TierName>ECommerce Server</TierName>
    <AverageResponseTime>8</AverageResponseTime>
    <CallsPerMinute>74</CallsPerMinute>
    <TotalCalls>1110</TotalCalls>
    <TotalErrors>0</TotalErrors>
    <ErrorsPerMinute>0</ErrorsPerMinute>
    <ErrorPercentage>0.0</ErrorPercentage>
    <SlowCalls>0</SlowCalls>
    <VerySlowCalls>0</VerySlowCalls>
    <Stalls>0</Stalls>
  </BusinessTransaction>
  <BusinessTransaction>
    <ApplicationName>ACME Book Store Application</ApplicationName>
    <BusinessTransactionName>UserLogin.memberLogin</BusinessTransactionName>
    <TierName>ECommerce Server</TierName>
    <AverageResponseTime>14</AverageResponseTime>
    <CallsPerMinute>50</CallsPerMinute>
    <TotalCalls>750</TotalCalls>
    <TotalErrors>0</TotalErrors>
    <ErrorsPerMinute>0</ErrorsPerMinute>
    <ErrorPercentage>0.0</ErrorPercentage>
    <SlowCalls>0</SlowCalls>
    <VerySlowCalls>0</VerySlowCalls>
    <Stalls>0</Stalls>
  </BusinessTransaction>
  <BusinessTransaction>
    <ApplicationName>ACME Book Store Application</ApplicationName>
    <BusinessTransactionName>ViewCart.addToCart</BusinessTransactionName>
    <TierName>ECommerce Server</TierName>
    <AverageResponseTime>23</AverageResponseTime>
    <CallsPerMinute>50</CallsPerMinute>
    <TotalCalls>750</TotalCalls>
    <TotalErrors>0</TotalErrors>
    <ErrorsPerMinute>0</ErrorsPerMinute>
    <ErrorPercentage>0.0</ErrorPercentage>
    <SlowCalls>0</SlowCalls>
    <VerySlowCalls>0</VerySlowCalls>
    <Stalls>0</Stalls>
  </BusinessTransaction>
  <BusinessTransaction>
    <ApplicationName>ACME Book Store Application</ApplicationName>
    <BusinessTransactionName>ViewCart.sendItems</BusinessTransactionName>
    <TierName>ECommerce Server</TierName>
    <AverageResponseTime>487</AverageResponseTime>
    <CallsPerMinute>74</CallsPerMinute>
    <TotalCalls>1110</TotalCalls>
    <TotalErrors>30</TotalErrors>
    <ErrorsPerMinute>2</ErrorsPerMinute>
    <ErrorPercentage>2.7</ErrorPercentage>
    <SlowCalls>0</SlowCalls>
    <VerySlowCalls>1</VerySlowCalls>
    <Stalls>0</Stalls>
  </BusinessTransaction>
  <BusinessTransaction>
    <ApplicationName>ACME Book Store Application</ApplicationName>
    <BusinessTransactionName>ViewItems.getAllItems</BusinessTransactionName>
    <TierName>ECommerce Server</TierName>
    <AverageResponseTime>23</AverageResponseTime>
    <CallsPerMinute>50</CallsPerMinute>
    <TotalCalls>750</TotalCalls>
    <TotalErrors>0</TotalErrors>
    <ErrorsPerMinute>0</ErrorsPerMinute>
    <ErrorPercentage>0.0</ErrorPercentage>
    <SlowCalls>0</SlowCalls>
    <VerySlowCalls>0</VerySlowCalls>
    <Stalls>0</Stalls>
  </BusinessTransaction>
</BusinessTransactions>

